//UC1 
mysql> create database AddressBookService;
Query OK, 1 row affected (0.00 sec)

mysql> show databases;
+--------------------+
| Database           |
+--------------------+
| addressbookservice |
| employeedb         |
| information_schema |
| mysql              |
| payroll_service    |
| performance_schema |
| sys                |
+--------------------+
7 rows in set (0.00 sec)

mysql> USE AddressBookService;
Database changed
mysql> SELECT DATABASE();
+--------------------+
| DATABASE()         |
+--------------------+
| addressbookservice |
+--------------------+
1 row in set (0.00 sec)  



//UC2

mysql> Create Table AddressBook
    -> (
    -> firstName varchar(50) NOT NULL,
    -> lastName  varchar(50) NOT NULL,
    -> address   varchar(100) NOT NULL,
    -> city      varchar(50) NOT NULL,
    -> state     varchar(50) NOT NULL,
    -> zip       varchar(50) NOT NULL,
    -> phoneNumber varchar(20) NOT NULL,
    -> email     varchar(50) NOT NULL,
    -> PRIMARY KEY (firstName)
    -> );
Query OK, 0 rows affected (0.02 sec)

mysql> DESCRIBE AddressBook;
+-------------+--------------+------+-----+---------+-------+
| Field       | Type         | Null | Key | Default | Extra |
+-------------+--------------+------+-----+---------+-------+
| firstName   | varchar(50)  | NO   | PRI | NULL    |       |
| lastName    | varchar(50)  | NO   |     | NULL    |       |
| address     | varchar(100) | NO   |     | NULL    |       |
| city        | varchar(50)  | NO   |     | NULL    |       |
| state       | varchar(50)  | NO   |     | NULL    |       |
| zip         | varchar(50)  | NO   |     | NULL    |       |
| phoneNumber | varchar(20)  | NO   |     | NULL    |       |
| email       | varchar(50)  | NO   |     | NULL    |       |
+-------------+--------------+------+-----+---------+-------+
8 rows in set (0.01 sec)


//UC3

mysql> INSERT INTO AddressBook (firstName,lastName,address,city,state,zip,phoneNumber,email) VALUES
    -> ('Rushi','Molkire','ShivNagar','Bidar','Karnataka','560012','8123932881','rushi.m@gmail.com'),
    -> ('Anup','Kumar','RRNagar','Banglore','Karnataka','560074','8073691947','anupk8084@gmail.com'),
    -> ('Abhi','Reddy','Namapally','Hyderabad','Telangana','500457','8176543222','abhi11@gmail.com'),
    -> ('Deekshit','Malhotra','RkColony','Udhampur','Jammu','180012','8765433754','deekm21@gmail.com'),
    -> ('Sagar','Hatte','GaneshNagar','Pune','Maharastra','436543','7545635632','sagarh24@gmail.com'),
    -> ('Shubham','Patil','JpNagar','Mumbai','Maharastra','576545','8144467381','shubhamp68@gmail.com');
Query OK, 6 rows affected (0.01 sec)
Records: 6  Duplicates: 0  Warnings: 0

mysql> select * from AddressBook;
+-----------+----------+-------------+-----------+------------+--------+-------------+----------------------+
| firstName | lastName | address     | city      | state      | zip    | phoneNumber | email                |
+-----------+----------+-------------+-----------+------------+--------+-------------+----------------------+
| Abhi      | Reddy    | Namapally   | Hyderabad | Telangana  | 500457 | 8176543222  | abhi11@gmail.com     |
| Anup      | Kumar    | RRNagar     | Banglore  | Karnataka  | 560074 | 8073691947  | anupk8084@gmail.com  |
| Deekshit  | Malhotra | RkColony    | Udhampur  | Jammu      | 180012 | 8765433754  | deekm21@gmail.com    |
| Rushi     | Molkire  | ShivNagar   | Bidar     | Karnataka  | 560012 | 8123932881  | rushi.m@gmail.com    |
| Sagar     | Hatte    | GaneshNagar | Pune      | Maharastra | 436543 | 7545635632  | sagarh24@gmail.com   |
| Shubham   | Patil    | JpNagar     | Mumbai    | Maharastra | 576545 | 8144467381  | shubhamp68@gmail.com |
+-----------+----------+-------------+-----------+------------+--------+-------------+----------------------+
6 rows in set (0.00 sec)


//UC4

mysql> UPDATE AddressBook set phoneNumber="8643055940" where firstName = 'Sagar';
Query OK, 1 row affected (0.00 sec)
Rows matched: 1  Changed: 1  Warnings: 0

mysql> select * from AddressBook;
+-----------+----------+-------------+-----------+------------+--------+-------------+----------------------+
| firstName | lastName | address     | city      | state      | zip    | phoneNumber | email                |
+-----------+----------+-------------+-----------+------------+--------+-------------+----------------------+
| Abhi      | Reddy    | Namapally   | Hyderabad | Telangana  | 500457 | 8176543222  | abhi11@gmail.com     |
| Anup      | Kumar    | RRNagar     | Banglore  | Karnataka  | 560074 | 8073691947  | anupk8084@gmail.com  |
| Deekshit  | Malhotra | RkColony    | Udhampur  | Jammu      | 180012 | 8765433754  | deekm21@gmail.com    |
| Rushi     | Molkire  | ShivNagar   | Bidar     | Karnataka  | 560012 | 8123932881  | rushi.m@gmail.com    |
| Sagar     | Hatte    | GaneshNagar | Pune      | Maharastra | 436543 | 8643055940  | sagarh24@gmail.com   |
| Shubham   | Patil    | JpNagar     | Mumbai    | Maharastra | 576545 | 8144467381  | shubhamp68@gmail.com |
+-----------+----------+-------------+-----------+------------+--------+-------------+----------------------+
6 rows in set (0.00 sec)


//UC5
mysql> DELETE from AddressBook where firstName='Shubham';
Query OK, 1 row affected (0.00 sec)

mysql> select * from AddressBook;
+-----------+----------+-------------+-----------+------------+--------+-------------+---------------------+
| firstName | lastName | address     | city      | state      | zip    | phoneNumber | email               |
+-----------+----------+-------------+-----------+------------+--------+-------------+---------------------+
| Abhi      | Reddy    | Namapally   | Hyderabad | Telangana  | 500457 | 8176543222  | abhi11@gmail.com    |
| Anup      | Kumar    | RRNagar     | Banglore  | Karnataka  | 560074 | 8073691947  | anupk8084@gmail.com |
| Deekshit  | Malhotra | RkColony    | Udhampur  | Jammu      | 180012 | 8765433754  | deekm21@gmail.com   |
| Rushi     | Molkire  | ShivNagar   | Bidar     | Karnataka  | 560012 | 8123932881  | rushi.m@gmail.com   |
| Sagar     | Hatte    | GaneshNagar | Pune      | Maharastra | 436543 | 8643055940  | sagarh24@gmail.com  |
+-----------+----------+-------------+-----------+------------+--------+-------------+---------------------+
5 rows in set (0.00 sec)


//UC6

mysql> INSERT INTO AddressBook (firstName,lastName,address,city,state,zip,phoneNumber,email) VALUES
    -> ('Shubham','Patil','JpNagar','Mumbai','Maharastra','576545','8144467381','shubhamp68@gmail.com');
Query OK, 1 row affected (0.00 sec)

mysql> select * from AddressBook;
+-----------+----------+-------------+-----------+------------+--------+-------------+----------------------+
| firstName | lastName | address     | city      | state      | zip    | phoneNumber | email                |
+-----------+----------+-------------+-----------+------------+--------+-------------+----------------------+
| Abhi      | Reddy    | Namapally   | Hyderabad | Telangana  | 500457 | 8176543222  | abhi11@gmail.com     |
| Anup      | Kumar    | RRNagar     | Banglore  | Karnataka  | 560074 | 8073691947  | anupk8084@gmail.com  |
| Deekshit  | Malhotra | RkColony    | Udhampur  | Jammu      | 180012 | 8765433754  | deekm21@gmail.com    |
| Rushi     | Molkire  | ShivNagar   | Bidar     | Karnataka  | 560012 | 8123932881  | rushi.m@gmail.com    |
| Sagar     | Hatte    | GaneshNagar | Pune      | Maharastra | 436543 | 8643055940  | sagarh24@gmail.com   |
| Shubham   | Patil    | JpNagar     | Mumbai    | Maharastra | 576545 | 8144467381  | shubhamp68@gmail.com |
+-----------+----------+-------------+-----------+------------+--------+-------------+----------------------+
6 rows in set (0.00 sec)

mysql> select * from AddressBook where city = 'Bidar';
+-----------+----------+-----------+-------+-----------+--------+-------------+-------------------+
| firstName | lastName | address   | city  | state     | zip    | phoneNumber | email             |
+-----------+----------+-----------+-------+-----------+--------+-------------+-------------------+
| Rushi     | Molkire  | ShivNagar | Bidar | Karnataka | 560012 | 8123932881  | rushi.m@gmail.com |
+-----------+----------+-----------+-------+-----------+--------+-------------+-------------------+
1 row in set (0.00 sec)

mysql> select * from AddressBook where state = 'Karnataka';
+-----------+----------+-----------+----------+-----------+--------+-------------+---------------------+
| firstName | lastName | address   | city     | state     | zip    | phoneNumber | email               |
+-----------+----------+-----------+----------+-----------+--------+-------------+---------------------+
| Anup      | Kumar    | RRNagar   | Banglore | Karnataka | 560074 | 8073691947  | anupk8084@gmail.com |
| Rushi     | Molkire  | ShivNagar | Bidar    | Karnataka | 560012 | 8123932881  | rushi.m@gmail.com   |
+-----------+----------+-----------+----------+-----------+--------+-------------+---------------------+
2 rows in set (0.00 sec)

//UC7

mysql> SELECT city,COUNT(city) as count from AddressBook group by city;
+-----------+-------+
| city      | count |
+-----------+-------+
| Hyderabad |     1 |
| Banglore  |     1 |
| Udhampur  |     1 |
| Bidar     |     1 |
| Pune      |     1 |
| Mumbai    |     1 |
+-----------+-------+
6 rows in set (0.00 sec)

mysql> SELECT state,COUNT(state) as count from AddressBook group by state;
+------------+-------+
| state      | count |
+------------+-------+
| Telangana  |     1 |
| Karnataka  |     2 |
| Jammu      |     1 |
| Maharastra |     2 |
+------------+-------+
4 rows in set (0.00 sec)


//UC8
mysql> SELECT firstName,lastName from addressBook ORDER BY city;
+-----------+----------+
| firstName | lastName |
+-----------+----------+
| Anup      | Kumar    |
| Rushi     | Molkire  |
| Abhi      | Reddy    |
| Shubham   | Patil    |
| Sagar     | Hatte    |
| Deekshit  | Malhotra |
+-----------+----------+
6 rows in set (0.00 sec)

//UC9

mysql> alter table AddressBook add type varchar(20) after lastName;
Query OK, 0 rows affected (0.01 sec)
Records: 0  Duplicates: 0  Warnings: 0

mysql> desc AddressBook;
+-------------+--------------+------+-----+---------+-------+
| Field       | Type         | Null | Key | Default | Extra |
+-------------+--------------+------+-----+---------+-------+
| firstName   | varchar(50)  | NO   | PRI | NULL    |       |
| lastName    | varchar(50)  | NO   |     | NULL    |       |
| type        | varchar(20)  | YES  |     | NULL    |       |
| address     | varchar(100) | NO   |     | NULL    |       |
| city        | varchar(50)  | NO   |     | NULL    |       |
| state       | varchar(50)  | NO   |     | NULL    |       |
| zip         | varchar(50)  | NO   |     | NULL    |       |
| phoneNumber | varchar(20)  | NO   |     | NULL    |       |
| email       | varchar(50)  | NO   |     | NULL    |       |
+-------------+--------------+------+-----+---------+-------+
9 rows in set (0.00 sec)

mysql> update AddressBook set type = 'Family' where firstName ='Rushi';
Query OK, 1 row affected (0.00 sec)
Rows matched: 1  Changed: 1  Warnings: 0

mysql> update AddressBook set type = 'Student' where firstName='Sagar';
Query OK, 1 row affected (0.00 sec)
Rows matched: 1  Changed: 1  Warnings: 0

mysql>  update AddressBook set type = 'Teacher' where firstName='Shubham';
Query OK, 1 row affected (0.00 sec)
Rows matched: 1  Changed: 1  Warnings: 0

mysql> update AddressBook set type = 'Trainer' where firstName='Abhi';
Query OK, 1 row affected (0.00 sec)
Rows matched: 1  Changed: 1  Warnings: 0

mysql> update AddressBook set type = 'Engineer' where firstName='Anup';
Query OK, 1 row affected (0.00 sec)
Rows matched: 1  Changed: 1  Warnings: 0

mysql> update AddressBook set type = 'Engineer' where firstName='Deekshit';
Query OK, 1 row affected (0.00 sec)
Rows matched: 1  Changed: 1  Warnings: 0

mysql> select * from AddressBook;
+-----------+----------+----------+-------------+-----------+------------+--------+-------------+----------------------+
| firstName | lastName | type     | address     | city      | state      | zip    | phoneNumber | email                |
+-----------+----------+----------+-------------+-----------+------------+--------+-------------+----------------------+
| Abhi      | Reddy    | Trainer  | Namapally   | Hyderabad | Telangana  | 500457 | 8176543222  | abhi11@gmail.com     |
| Anup      | Kumar    | Engineer | RRNagar     | Banglore  | Karnataka  | 560074 | 8073691947  | anupk8084@gmail.com  |
| Deekshit  | Malhotra | Engineer | RkColony    | Udhampur  | Jammu      | 180012 | 8765433754  | deekm21@gmail.com    |
| Rushi     | Molkire  | Family   | ShivNagar   | Bidar     | Karnataka  | 560012 | 8123932881  | rushi.m@gmail.com    |
| Sagar     | Hatte    | Student  | GaneshNagar | Pune      | Maharastra | 436543 | 8643055940  | sagarh24@gmail.com   |
| Shubham   | Patil    | Teacher  | JpNagar     | Mumbai    | Maharastra | 576545 | 8144467381  | shubhamp68@gmail.com |
+-----------+----------+----------+-------------+-----------+------------+--------+-------------+----------------------+
6 rows in set (0.00 sec)

//UC10

mysql> select type, Count(type) from AddressBook group by type;
+----------+-------------+
| type     | Count(type) |
+----------+-------------+
| Trainer  |           1 |
| Engineer |           2 |
| Family   |           1 |
| Student  |           1 |
| Teacher  |           1 |
+----------+-------------+
5 rows in set (0.00 sec)
